id,title,description,price,currency,category
1,"Зеркало классическое Napoli","Элегантное зеркало с фацетной обработкой края. Цена за 1 м².","4200","RUB","Классические"
2,"Зеркало с LED подсветкой Napoli","Современное зеркало с LED-подсветкой. Цена за 1 м².","7800","RUB","С подсветкой"
3,"Зеркало безрамное Napoli","Минималистичное зеркало без рамы. Цена за 1 м².","3400","RUB","Безрамные"
4,"Зеркало в багетной раме Napoli","Зеркало в багетной раме ручной работы. Цена за 1 м².","6500","RUB","В раме"
5,"Зеркало круглое Napoli","Стильное круглое зеркало. Цена за 1 м².","5200","RUB","Круглые"
6,"Зеркало с гравировкой Napoli","Зеркало с художественной гравировкой. Цена за 1 м².","9200","RUB","С гравировкой"